{"agent":{"configuration":"same fixed configuration for both conditions","implementation":"deterministic-normalized-continuation-agent.v1","max_tokens":null,"max_tool_calls":20,"model":"Luna Max","prompt_template":"Observe the normalized condition output and continue only from the declared signal fields.","tool_configuration":{"max_continue_calls":1,"max_observation_calls":2,"operations":["observe","continue"]}},"base_commit":"7d6e267c6e89cdcd8a71644c67c95d2ab4260330","baselines":["polling","filesystem_watch","ordinary_notification","repeated_observation","asw"],"frozen_at":"2026-08-02T08:58:34Z","layer_a_repetitions_primary":20,"layer_a_repetitions_secondary":10,"layer_b_repetitions":3,"metrics":{"layer_a":["detected","detection_latency_ms","observation_count","missed","duplicate_count","false_positive_count","application_attribution_correct","kind_correct","subject_correct","localization_correct","continuation_ready"],"layer_b":["continuation_success","agent_tool_calls","agent_observation_calls","continuation_latency_ms","incorrect_action_count","input_tokens","output_tokens"]},"ordinary_notification_template":"{application}: {plain_status_text}","poll_interval_ms":250,"primary_scenarios":["job_completion","file_artifact_transition","ui_transition"],"random_delay_ms":{"max":2000,"min":500},"run_id":"asw-mvp-eval-20260802-04","scenario_deadline_ms":15000,"schema_version":"asw.evaluation_profile.v1","secondary_scenarios":["render_export","process_crash_restart"],"seed":20260802,"selection_rule":{"ordered_keys":["highest_detection_success","lowest_miss_rate","lowest_median_observation_count","lowest_median_detection_latency_ms","lexical_condition_id"]},"thresholds":{"attribution_accuracy_min":0.98,"detection_success_min":0.98,"duplicate_rate_max":0.02,"false_positive_rate_max":0.02,"kind_accuracy_min":0.98,"layer_a_detection_noninferiority_pp":0.02,"layer_a_observation_reduction_min":0.3,"layer_a_required_primary_classes":2,"layer_b_efficiency_improvement_min":0.2,"layer_b_success_noninferiority_pp":0.05}}
